id,pages,year,title,author,price,dimensions,materials,description,reference,images,publisher,edition,binding,isbn
14,88.0,2022.0,Restored/Access,,32.0,7 x 10 inches,,"With texts by Keko Jackson and Matthew Grumbach “Allensworth is the first town in California to be founded, financed, and governed exclusively by Black people. Founded in 1908 as a symbol of freedom in the West, it is part of a long legacy of independent and autonomous communities created by revolutionaries and people who escaped enslavement. The town was started by Allen Allensworth, who was himself born into enslavement, and saw the land as an opportunity to live out a version of the American Dream. In its early years Allensworth saw a lot of success and self-sufficiency, establishing a free public library, access to inexpensive land and resources and a system of cooperative economics. However by 1915, a variety of causes including severe drought, racially motivated attacks, and the discovery of arsenic in the ground water ultimately led to the town’s decline. Today, Allensworth remains a state park which attempts to preserve the unique history of the land. While the demographics have largely shifted, Tulare County continues to be one of the poorest counties in the state. With this project I hope to share the story and history of a place I never learned about until coming across some boxes at my uncle’s house. By combining my own images with archival materials from his collection I attempt to bring together visual narratives both past and present to illustrate the evolution of a town that once meant so much to so many.” —Keko Jackson Keko Jackson is an artist and archivist based in Los Angeles. His work combines his interests in photography, history, and storytelling, often incorporating poetics of nature and landscape to reveal alternative histories and larger systemic inequities.",,"['https://centerforbookarts.org/wp-content/uploads/2023/10/keko-jackson_restored-access_1_1728x.png', 'https://centerforbookarts.org/wp-content/uploads/2023/10/keko-jackson_restored-access_2_1728x.webp', 'https://centerforbookarts.org/wp-content/uploads/2023/10/keko-jackson_restored-access_4_1728x.webp', 'https://centerforbookarts.org/wp-content/uploads/2023/10/keko-jackson_restored-access_5_1728x.webp', 'https://centerforbookarts.org/wp-content/uploads/2023/10/keko-jackson_restored-access_6_1728x.webp', 'https://centerforbookarts.org/wp-content/uploads/2023/10/keko-jackson_restored-access_7_1728x.webp', 'https://centerforbookarts.org/wp-content/uploads/2023/10/keko-jackson_restored-access_1_1728x.webp']",Sming Sming,300,"spiral bound, softcover",
15,190.0,2023.0,Off-Register (pre-order),Mela Dávila Freire,28.0,6.5 x 10 inches,"['offset printed', 'two colors', 'English/Spanish']","This catalog documents the creative practices of a series of Latin American women artists who, between 1960 and 1990, channeled part of their artistic impetus into printed and serialized media. The time span covered by the exhibition tracks the expansion of the conceptual movement, which began around 1960 and, depending on the geographical contexts, would last until the end of the 1980s. This was the time when artists’ books and other printed matter joined the list of new formats—installation, video, performance…—that were beginning to spread beyond the classic artistic genres and widen the field of possibilities for creators. *This catalog will ship on November 30, 2023. *This catalog will ship on November 30, 2023.",,['https://centerforbookarts.org/wp-content/uploads/2023/09/Screen-Shot-2023-09-20-at-5.51.50-PM.png'],Center for Book Arts,1000,Perfect Bound Softcover,978-1-951163-15-0
16,,2023.0,Embodied Alienation,Tamen Pérez,400.0,24 x 20 inches,"['canvas', 'grommets', 'usb cable', 'silver paint']","Large red stained canvas book, bound with grommets and an old usb cable dipped in silver paint. I was inspired by Mary Heilmann’s Book of the Night. The book subverts the function of written text not only by omitting text completely, but also by pushing against the expectations of content delivery within the book form itself. The reader must turn the pages and see what can be read phenomenologically instead of literally. Book of the Night",,"['https://centerforbookarts.org/wp-content/uploads/2023/09/Red-Book-1.png', 'https://centerforbookarts.org/wp-content/uploads/2023/09/Red-Book-2-scaled.jpg', 'https://centerforbookarts.org/wp-content/uploads/2023/09/Red-Book-3-scaled.jpg', 'https://centerforbookarts.org/wp-content/uploads/2023/09/Red-Book-1-scaled.jpg']",Tamen Perez,Unique,"Grommets, bound with USB Cable",
17,,2023.0,Three Constitutions,Russell Maret,5250.0,11.25 x 16 inches,"['Letterpress printed', 'One coptic book sewn into boards', 'two soft cover hand sewn books', 'plexi case']","Three Constitutions is an exploration of originalist thinking in constitutional interpretation. It consists of three volumes. The actual text of the constitution and amendments are set in a typeface that at first glance appears like an archaic alphabet but becomes legible as one reads. This volume is contained within an acrylic vitrine as it it is an inaccessible artifact. The two other volumes are the “interpretations.” One is a redacted version of the text that is inspired by the idea that most constitutional zealots get their information from biased news commentators which is similar to reading a redacted text. The other interpretation is inspired by the idea that the other primary source of constitutional information is the internet. For this volume the original text was translated via Google into Esperanto, from Esperanto into Russian, from Russian into Mandarin, and from mandarin back into English. The resulting text is what was printed. Three Constitutions",,"['https://centerforbookarts.org/wp-content/uploads/2023/09/2124_RM_3Constitutions_088-1-scaled.jpg', 'https://centerforbookarts.org/wp-content/uploads/2023/09/2124_RM_3Constitutions_026-1-scaled.jpg', 'https://centerforbookarts.org/wp-content/uploads/2023/09/2124_RM_3Constitutions_008-1-scaled.jpg']",Russell Maret,,Three books in box,
18,,2023.0,Ornography,Sarah Moody,,3.75 x 5.25 inches,"['Letterpress printed', 'Softcover longstitch bound book', 'bristol slipcase']","Ornography is a playful specimen of ornaments, fleurons, and dingbats in the collection of Russell Maret. It is covered in vintage katazome paper and housed in a rigid bristol board slipcase. Ornography",,"['https://centerforbookarts.org/wp-content/uploads/2023/09/2362_Ornography_025-1-scaled.jpg', 'https://centerforbookarts.org/wp-content/uploads/2023/09/2362_Ornography_023-1-scaled.jpg']",Russell Maret,,Handsewn Softcover,
19,,2021.0,Z is for Zahar,Rhonda Khalifeh,1500.0,16 x 10 in,"['Digital printing on paper', 'fabric statches']","Z is for Zahar offers a look into conversations with 8 new Project Z participants and the garments created in dialogue with them. This four part unique artist’s book is the newest addition to the Project Z archive and a material companion to Project Z Book 2 (October 2022, Open Projects Press). Spanning from 2019-2021, Z is for Zahar layers material scraps, process notes, interview content, fitting photos, and finished garment photos to present an alternative garment-making narrative that privileges human relationships. Z is for Zahar",,"['https://centerforbookarts.org/wp-content/uploads/2023/09/z_zahar.04-scaled.jpg', 'https://centerforbookarts.org/wp-content/uploads/2023/09/z_detail.01-scaled.jpg', 'https://centerforbookarts.org/wp-content/uploads/2023/09/z_zahar.05-scaled.jpg', 'https://centerforbookarts.org/wp-content/uploads/2023/09/z_zahar.06-scaled.jpg', 'https://centerforbookarts.org/wp-content/uploads/2023/09/z_zahar.08-scaled.jpg']",Rhonda Khalifeh,Unique,Bolt + Grommet,
20,,2022.0,Body of Evidence,Ana Cordeiro,7500.0,10 x 17 inches,"['Full leather cover with leather inlay and onlay', 'Silkscreen', 'Letterpress', 'Woodcut', 'Intaglio', 'Linocut', 'Cyanotype', 'Van Dyke Brown', 'Fabric inserts']",,,"['https://centerforbookarts.org/wp-content/uploads/2023/09/cordeiro_ana_03.png', 'https://centerforbookarts.org/wp-content/uploads/2023/09/cordeiro_ana_02-scaled.jpg', 'https://centerforbookarts.org/wp-content/uploads/2023/09/cordeiro_ana_05-scaled.jpg', 'https://centerforbookarts.org/wp-content/uploads/2023/09/03BofE_Fernando_Pessoa_page-1-scaled.jpg', 'https://centerforbookarts.org/wp-content/uploads/2023/09/01BofE_flag_page-1-scaled.jpg', 'https://centerforbookarts.org/wp-content/uploads/2023/09/DSC_0239-scaled.jpeg']",Ana Cordeiro,9,Full leather hardcover in clamshell,
21,,,Letterpress Bookmark,,,,,"Bookmark, designed and printed by Caroline Wood and Gillian Lee at Center for Book Arts, 2023. Variable size/color.",,['https://centerforbookarts.org/wp-content/uploads/2023/08/IMG_2148-scaled.jpg'],,,,
22,6.0,2023.0,Beau Geste Press Exhibition Brochure,Alice Motard,5.0,4.25 x 11 inches,,,,['https://centerforbookarts.org/wp-content/uploads/2023/07/beau-geste-press.jpg'],Center for Book Arts,,"Soft cover, saddle stitch",
23,1.0,2023.0,Rituals Here Exhibition Brochure,Lukaza Branfman-Verissimo,5.0,3.75 x 8.5 inches,,Rituals Here,,['https://centerforbookarts.org/wp-content/uploads/2023/07/rituals-here.jpg'],Center for Book Arts,,Six panel brochure,
24,1.0,2023.0,I Couldn’t Read What I Dreamt Of Exhibition Brochure,,5.0,3.5 x 7.87 inches,,,,['https://centerforbookarts.org/wp-content/uploads/2023/07/I-couldnt-read-what-I-dreamt-of-.jpg'],Center for Book Arts,,Six panel brochure,
25,,,Galley Tray / Type Setting Deposit for Studio Rental,,50.0,,,"Setting type at CBA requires a $50 deposit. Typesetters can have type in use for up to 3 months. After type is redistributed, the deposit can be returned or applied to future typesetting or studio rental. After purchase pick up your galley tray at the front desk. Galley trays must be stored in the galley cabinet that corresponds to the tray number and all type ID information must be recorded in the galley binder. Please ask if you need guidance on typesetting policies. All CBA studio users must first take the Studio Rental Training Course, which you can enroll in on the workshop page.  All CBA studio users must first take the Studio Rental Training Course, which you can enroll in on the workshop page.  workshop page. All CBA studio users must be members of Center for Book Arts. You can become a member or renew your membership here. All CBA studio users must be members of Center for Book Arts. You can become a member or renew your membership here. here.",,"['https://centerforbookarts.org/wp-content/uploads/2023/07/type_lowell_bodger-scaled.jpg', 'https://centerforbookarts.org/wp-content/uploads/2023/07/galleys_1-scaled.jpg', 'https://centerforbookarts.org/wp-content/uploads/2023/07/type-scaled.jpg', 'https://centerforbookarts.org/wp-content/uploads/2023/07/galleys_2-scaled.jpg']",,,,
26,,,Additional Storage for Studio Rental,,,,,"Add on storage space to any rental type. Storage is rented by the month. Renters can add a shelf for $100 per month or a flat file drawer for $50 per month. Renting storage space also requires a deposit equivalent to one month’s rent, which can be returned or applied to a future rental after the rental period is over. Please inquire with studio@centerforbookarts.org to make sure we have a space available before you purchase. Storage rental can be on a month to month or recurring basis. By signing up for a recurring rental you are agreeing to have your rental automatically renew each month. Please contact studio@centerforbookarts.org to cancel at any time. After purchase please contact the studio coordinator at studio@centerforbookarts.org to start your storage rental. All CBA studio users must first take the Studio Rental Training Course, which you can enroll in on the workshop page.  All CBA studio users must first take the Studio Rental Training Course, which you can enroll in on the workshop page.  workshop page. All CBA studio users must be members of Center for Book Arts. You can become a member or renew your membership here. All CBA studio users must be members of Center for Book Arts. You can become a member or renew your membership here. here.",,"['https://centerforbookarts.org/wp-content/uploads/2023/07/flat_files-scaled.jpg', 'https://centerforbookarts.org/wp-content/uploads/2023/07/shelves-scaled.jpg']",,,,
27,,2023.0,Department of N.S.A. (No Strings Attached) – Office of Memorandums [Extracts] Vol. 1,Rodrigo Moreira,40.0,3.5 x 5 inches,,Artists’ book resembling a US passport with navy blue leatherette covers. Risograph printed interior.,,['https://centerforbookarts.org/wp-content/uploads/2023/07/IMG_3507.gif'],Center for Book Arts,50,Artist Book,
28,,,Kick Activist,Laura Nova,,5 × 7 in | 12.7 × 17.8 cm,"['Digital Printing', 'Offset']","Kung Fu Master Poa Shen Wong, a nonagenarian immigrant from Hong Kong teaches her martial arts at the Little Flower Park Basketball Court in our Lower East Side neighborhood. In the documentary video, Poa describes how a meditation group attempted to take over her exercise turf, but Poa fights back and reclaims her territory in the public park, while also offering us her exercise sequence. To encourage both activist and active audience participation, Poa offers us her exercise sequence of 36 movements. In sharing her technique and her secrets of longevity, Poa hopes to plant seeds to take root for the next generation. In service of her goal, Laura Nova created these kick cards to allow audiences step-by-step guidance.",,"['https://centerforbookarts.org/wp-content/uploads/2023/09/LauraNova_KickCards.png', 'https://centerforbookarts.org/wp-content/uploads/2023/09/LauraNova_KickCards.1-2-scaled.jpg', 'https://centerforbookarts.org/wp-content/uploads/2023/09/LauraNova_KickCards.2-2-scaled.jpg']",Laura Nova,,Giant size card deck with custom tuck case,
29,52.0,2022.0,ÆROTOMANIA FLIGHT DECK,Adeena Karasick,50.0,4.5 x 6.5 inches,,"In the wake of Covid, of not being able to travel as much as we liked, I began thinking about how the airplane as an erotic theater, a social text of secret motives, is structured like a language. As both a love letter and a lament to the airplane, it speaks to ways both individuals and meaning get transported to multiple and sometimes unexpected destinations; and how, like language itself, the airplane becomes a symbol of hope. As a border-blurring text incorporating elements of visual poetry/concrete work, asemic/sound poetry, theoretical discourse, and poetic, philosophical, and Kabbalistic aphorisms, Ærotomania highlights how language–an ever-swirling palimpsest of spectral voices, textures, whispers, and codes–transports us through passion, politics, pleasure, and promise as we negotiate loss and light towards new ways of seeing and being; and, like the airplane, flies through a variety of zones and registers, soaring to higher and higher levels, carrying its passengers through radically transformative possibilities. And though it can be read “in order,” it is organized as a “Shuffle Deck,” as often meaning get rerouted, or hijacked and thus can be read in any order whereby each card becomes a step in a trans/slantic journey of intermediatic play.",,"['https://centerforbookarts.org/wp-content/uploads/2023/07/AEROTOMAnia-flight-deck-cover-.jpg', 'https://centerforbookarts.org/wp-content/uploads/2023/07/23-08-29-deck-1.png', 'https://centerforbookarts.org/wp-content/uploads/2023/07/Deck-Design_Karasick-1-1.jpg', 'https://centerforbookarts.org/wp-content/uploads/2023/07/Deck-Design_Karasick-1-29.jpg', 'https://centerforbookarts.org/wp-content/uploads/2023/07/Deck-Design_Karasick-1-48.jpg', 'https://centerforbookarts.org/wp-content/uploads/2023/07/Deck-Design_Karasick-1-50.jpg']",NuJu Books,,full color boxed deck of cards,979-888680011-1
30,,2023.0,Bookmarks by Slavko,Slavko Djuric,6.5,2 x 7 inches,,"Following the first edition of popsicle shaped bookmarks titled ‘And every time you read a book, someone eats your ice-cream’, this summer we are happy to enhance your solitary reading activities in-the-sun with an ice-cream cone shaped bookmarks. One cone per order, all bookmarks are unique. unique",,"['https://centerforbookarts.org/wp-content/uploads/2023/07/bookmarks-3.gif', 'https://centerforbookarts.org/wp-content/uploads/2023/07/bookmarks-2.gif', 'https://centerforbookarts.org/wp-content/uploads/2023/07/bookmarks-1.gif']",,Variable edition of 314,linocut bookmarks with collaged elements from various leftover prints,
31,,,Hourly Studio Rental,,,,,"Purchase hours in increments of 1, 6 or 15 hours. 6 and 15 hour purchases include a discount on the $15 per hour regular hourly cost and renters will receive a punch card. Punch card hours must be used within one year of purchase date. Hourly renters may use the studio from 10 a.m. to 6 p.m., Monday through Friday and 10 a.m. to 5 p.m. on Saturday. The Center is closed to the public on Sundays. For more info about studio rental check out the studio page. the studio page. After purchasing this item online, please pick up your punch card at the front desk. All CBA studio users must first take the Studio Rental Training Course, which you can enroll in on the workshop page.  All CBA studio users must first take the Studio Rental Training Course, which you can enroll in on the workshop page.  workshop page. All CBA studio users must be members of Center for Book Arts. You can become a member or renew your membership here. All CBA studio users must be members of Center for Book Arts. You can become a member or renew your membership here. here.",,"['https://centerforbookarts.org/wp-content/uploads/2023/06/cba_15hr_rental_card.jpg', 'https://centerforbookarts.org/wp-content/uploads/2023/06/cba_6hr_rental_card.jpg', 'https://centerforbookarts.org/wp-content/uploads/2023/06/nipping_presses-scaled.jpg', 'https://centerforbookarts.org/wp-content/uploads/2023/06/bindery_2-scaled.jpg', 'https://centerforbookarts.org/wp-content/uploads/2023/06/IMG_7430-scaled.jpg', 'https://centerforbookarts.org/wp-content/uploads/2023/06/IMG_7446-scaled.jpg', 'https://centerforbookarts.org/wp-content/uploads/2023/06/22-12-13_with-Oswaldo-and-Caslon-scaled.jpg']",,,,
32,,,Monthly Basic Studio Rental,,,,,"The basic monthly rental gives renters unlimited access to CBA’s studios during regular business hours.  This option is perfect for renters who need more time in the studio but may be new to CBA. Storage is not included with this rental option, but you may add on a flat file drawer or storage shelf for an additional monthly fee. Adding storage requires a $50 deposit for a flat file and a $100 deposit for a shelf. With this rental option, the studio may be accessed from 10 a.m. to 6 p.m., Monday through Friday and 10 a.m. to 5 p.m. on Saturday. The Center is closed to the public on Sundays. Monthly renters can choose to rent for one month, or to sign up for a monthly recurring membership. By signing up for a recurring rental you are agreeing to have your rental automatically renew each month. Please contact studio@centerforbookarts.org to cancel at any time. After purchase please contact the studio coordinator at studio@centerforbookarts.org to begin your monthly rental. All CBA studio users must first take the Studio Rental Training Course, which you can enroll in on the workshop page.  All CBA studio users must first take the Studio Rental Training Course, which you can enroll in on the workshop page.  workshop page. All CBA studio users must be members of Center for Book Arts. You can become a member or renew your membership here. All CBA studio users must be members of Center for Book Arts. You can become a member or renew your membership here. here.",,"['https://centerforbookarts.org/wp-content/uploads/2023/06/22-12-13_with-Oswaldo-and-Caslon-scaled.jpg', 'https://centerforbookarts.org/wp-content/uploads/2023/06/nipping_presses-scaled.jpg', 'https://centerforbookarts.org/wp-content/uploads/2023/06/bindery_2-scaled.jpg', 'https://centerforbookarts.org/wp-content/uploads/2023/06/IMG_7430-scaled.jpg', 'https://centerforbookarts.org/wp-content/uploads/2023/06/IMG_7446-scaled.jpg']",,,,
33,84.0,2023.0,BAR Issue 2: Hidden Parts of Publishing,,,7 x 10 inches,"['Offset', 'Risograph', 'Letterpress', 'Digital']","Features Matvei Yankelevich Paige Landesberg Claudia de la Torre Reviews Jennie Hinchcliff  Deep Time Katy Nelson  Utopia Myopia Philo Cohen Tender Noted Vivian Sming Separadores/Bookmarks Allie Haeusslein Houseplants WELCOME TO ISSUE 2 OF Book Art Review and thank you for your continued interest and support. While we have encountered a few obstacles in the production of the print edition of the magazine, we are greatly encouraged by the response we have received to the initiative and to the contents of Issue 1 online. We continue to see enthusiasm for a platform to engage with the artists’ book as an object and discuss how and why it works as an object—and for building and expanding a community with whom to share the excitement and fun of such conversations. 2022 has seen the return of in-person book fairs and the opportunity to come together to look at and talk about artists’ books along with questions of social responsibility, sustainability, and ethics. These topics are important parts of BAR and we hope you will join us in this dialogue. Add your voice and let us know what you think of our direction, design, and ideas and pitch us with your writing. Book Art Review  With Issue 2, we examine the “Hidden Parts of Design and Publishing.” How do the decisions that unfold during the process of bringing an artists’ book from conception to delivery reflect tradeoffs between an artist’s ideas and practical constraints of design, materials, and production? How do discussions between the collaborators impact the book? And how do the economics of the book shape the content and form? We are excited to have a range of writers exploring these questions across a broad spectrum of codex and non-traditional forms of the book. For Issue 2, we have partnered with Clifton Meador and his students at Appalachian State University to work on the design and production of this issue and are including their thoughts on going through this process with us. Finally, thank you for your patience as we smooth out our processes and settle on a more regular semi-annual cadence. Sincerely, The Editors Book Art Review (BAR) is a semiannual magazine dedicated to providing a forum for critical writing about book art and artist books. Book Art Review Book Art Review publishes two issues per year, with the first issue launching in Fall 2021. We want to raise the bar for book art criticism! BAR is our plan to make book art criticism more visible and more valuable, and to engage with a diverse group of writers and readers. Our launching manifesto calls for “New Book Art Criticism,” and in building that, our magazine will showcase a new kind of writing about artist books, one that focuses on the material, paginated, object qualities of the book. Book Art Review",,['https://centerforbookarts.org/wp-content/uploads/2022/08/IMG_3336-scaled.jpg'],Center for Book Arts,,Perfect Bound Softcover,
34,33.0,2022.0,E unum pluribus,Slavko Djuric,600.0,7.25x10,"['Woodcut', 'Intaglio', 'Linocut', 'Slipcase']","E unum pluribus (Many within One) is a set of unbound prints composed from 20 linocuts overprinted in numerous press runs. While their visual likeness suggests interconnectedness, each print exists as a part of an undefinable whole. The viewer is invited to explore these connections by assembling them in any desired order. E unum pluribus Many within One Slavko Djuric (b.1979, Yugoslavia) is a multidisciplinary artist trained in traditional printmaking under the mentorship of prof. Zoran Marjanovic at the University of Art in Pristina, Serbia. His practice spans from drawing and photography to artist books and site specific installations. Slavko Djuric His recent work explores the interchangeable and fluctuating structures of his art objects. He is a receiver of a Scholarship for Advanced Studies in Book Arts for 2019 at the Center for Book Arts, NYC.",,"['https://centerforbookarts.org/wp-content/uploads/2023/06/IMG_9865-1-scaled.jpg', 'https://centerforbookarts.org/wp-content/uploads/2023/06/IMG_4152-scaled.jpg', 'https://centerforbookarts.org/wp-content/uploads/2023/06/IMG_4225-1-scaled.jpg', 'https://centerforbookarts.org/wp-content/uploads/2023/06/IMG_4183-scaled.jpg']",,10,Unbound,
35,,2023.0,Enlisting Whitman and Emerson,Angela Lorenz,650.0,8 x 10.5 inches,"['Two color risograph', 'Letterpress', 'Mohawk Superfine']","Enlisting Whitman – A Pro Memoria Game for Emerson and Whitman Leaves of Grass Printed in the studios of Center for Book Arts by Roni Gross. About the Artist Visual artist Angela Lorenz (b. USA) resides in New England with annual stays in Bologna, Italy. Her work centers on material culture, visual culture and language, and uses humor as a mnemonic to aid memory. Lorenz’s watercolors, prints, multiples, mosaics and artist’s books live in over 100 public collections in the US and abroad, and have been widely exhibited. Angela Lorenz",,"['https://centerforbookarts.org/wp-content/uploads/2023/06/whitman.jpg', 'https://centerforbookarts.org/wp-content/uploads/2023/06/IMG_3307-scaled.jpg']",Center for Book Arts,75,,
